Expense Category,Description,Grant/Subsidy Target,Status
Hardware,Tablets (iPads/Surface) for shop floor & installers,Alberta Innovates PDP / CDAP,Planned
Cloud Infrastructure,AWS/Azure hosting fees for drawing storage,SR&ED / Business Expense,Ongoing
Software Licenses,Cursor (AI coding) / GitHub / Jira / Figma,SR&ED / Business Expense,Ongoing
Third-party Consulting,UI/UX design or Security Audit by external firm,Alberta Innovates Voucher,Planned
Travel/Marketing,Local travel to cabinet factory & site visits,Business Expense,Ongoing
Professional Fees,Legal fees for MOU/TOS / Accounting for SR&ED claim,Alberta Innovates Voucher,Planned
Marketing,Website hosting and digital advertising,CDAP ($2400 Micro-grant),Planned
